{
  "$schema": "https://json-schema.org/draft/2020-12/schema",
  "$id": "urn:cartografo:schema:grafo:1.0.0",
  "title": "Documento de grafo (cartografo)",
  "description": "Formato do documento de grafo: nós com role/skill/contract, arestas com condição, metadados de classe (D8) e linhagem (D13). Este documento é o snapshot completo de uma versão de grafo — o mesmo conteúdo que grafo_versao.snapshot guarda no banco (D15) e que sai como bundle mínimo exportável. Validação estrutural aqui é de FORMA; as quatro regras de soundness (alcançável, termina, aresta_com_condicao, no_com_contrato) são semânticas e vivem em scripts/validar-grafo.mjs.",
  "type": "object",
  "required": [
    "problem_class",
    "lineage",
    "metadata",
    "nodes",
    "edges",
    "initial_node",
    "final_nodes"
  ],
  "additionalProperties": false,
  "properties": {
    "problem_class": {
      "type": "string",
      "minLength": 1,
      "description": "Identidade da classe de problema, nomeada pelo usuário (D8). Raiz de versionamento do grafo e unidade de agregação da telemetria.",
      "examples": ["desenvolvimento-de-software", "bets-assimetricas"]
    },
    "lineage": {
      "$ref": "#/$defs/lineage"
    },
    "metadata": {
      "$ref": "#/$defs/metadata"
    },
    "nodes": {
      "type": "array",
      "minItems": 1,
      "description": "Etapas do grafo. Portão é nó (node_type: gate), não entidade separada.",
      "items": { "$ref": "#/$defs/node" }
    },
    "edges": {
      "type": "array",
      "description": "Transições entre nós, cada uma rotulada por uma condição.",
      "items": { "$ref": "#/$defs/edge" }
    },
    "initial_node": {
      "$ref": "#/$defs/node_id",
      "description": "Id do nó por onde toda travessia começa. Precisa existir em nodes."
    },
    "final_nodes": {
      "type": "array",
      "minItems": 1,
      "uniqueItems": true,
      "description": "Ids dos nós que encerram a travessia. Todo id precisa existir em nodes.",
      "items": { "$ref": "#/$defs/node_id" }
    },
    "hooks": {
      "type": "array",
      "description": "Reações que o próprio grafo declara: entrar num nó ou bloquear nele dispara uma entrega assinada (t169). Opcional — ausente significa nenhuma reação, e é por isso que todo grafo escrito antes deste campo continua válido sem tocar em nada, mesma postura não-quebradora do campo engine no nó. Ficam AQUI, e não numa assinatura registrada por fora pela API, para que a reação seja versionada e proponível como qualquer outra parte do grafo (D2, D15).",
      "items": { "$ref": "#/$defs/hook" }
    }
  },
  "$defs": {
    "node_id": {
      "type": "string",
      "minLength": 1,
      "pattern": "^[a-z0-9][a-z0-9_-]*$",
      "description": "Identificador de nó, único no documento. Minúsculas, dígitos, hífen e underscore."
    },
    "lineage": {
      "type": "object",
      "description": "Posição do grafo na linhagem da classe (D13): cada classe tem um grafo-base e um projeto pode ter uma variante, que é fork do base. O fork nasce de proposta do topógrafo com evidência, nunca de decisão a priori.",
      "required": ["type"],
      "additionalProperties": false,
      "properties": {
        "type": {
          "enum": ["base", "variante"],
          "description": "base: o grafo canônico da classe. variante: fork de um base, com diff e linhagem registrados."
        },
        "base_class": {
          "type": "string",
          "minLength": 1,
          "description": "Classe do grafo-base do qual esta variante saiu. Obrigatório quando type = variante."
        },
        "source_proposal_id": {
          "type": "string",
          "minLength": 1,
          "description": "Id da proposta do topógrafo que originou o fork (D13). Opcional: uma variante importada de um atlas externo pode não ter proposta local de origem."
        }
      },
      "allOf": [
        {
          "if": { "properties": { "type": { "const": "variante" } }, "required": ["type"] },
          "then": { "required": ["type", "base_class"] }
        },
        {
          "if": { "properties": { "type": { "const": "base" } }, "required": ["type"] },
          "then": {
            "not": { "anyOf": [{ "required": ["base_class"] }, { "required": ["source_proposal_id"] }] }
          }
        }
      ]
    },
    "metadata": {
      "type": "object",
      "description": "Gaveta de metadados do documento. Deliberadamente aberta a chaves extras (additionalProperties: true) enquanto o formato não congela — regra dos dois consumidores.",
      "required": ["name", "schema_version"],
      "additionalProperties": true,
      "properties": {
        "name": {
          "type": "string",
          "minLength": 1,
          "description": "Nome legível do grafo."
        },
        "description": {
          "type": "string",
          "description": "O que este mapa cobre, em uma ou duas frases."
        },
        "schema_version": {
          "type": "string",
          "pattern": "^\\d+\\.\\d+\\.\\d+$",
          "description": "Versão do schema do documento contra a qual este grafo foi escrito (semver; casa com a versão em $id)."
        },
        "created_at": {
          "type": "string",
          "format": "date",
          "description": "Data de criação do documento (AAAA-MM-DD)."
        },
        "source": {
          "type": "string",
          "description": "De onde este grafo veio: sintetizador, porte manual, importação de atlas."
        }
      }
    },
    "node": {
      "type": "object",
      "description": "Uma etapa do grafo. Tudo que executa é skill com contrato; o que muda é o papel (fazer, conferir, rotear).",
      "required": ["id", "role", "node_type", "skill_ref", "contract"],
      "additionalProperties": false,
      "properties": {
        "id": { "$ref": "#/$defs/node_id" },
        "role": {
          "type": "string",
          "minLength": 1,
          "description": "Quem faz o trabalho, na linguagem do domínio (arquiteto, desenvolvedor, tester).",
          "examples": ["arquiteto", "desenvolvedor", "red-team"]
        },
        "description": {
          "type": "string",
          "description": "O que este nó faz, em uma frase."
        },
        "node_type": {
          "enum": ["work", "gate"],
          "description": "work: produz artefato. gate: confere e roteia — pass/fail/escalate_human, sempre com evidência. Portão é nó como outro qualquer, e determinístico sempre que possível."
        },
        "engine": {
          "type": "string",
          "minLength": 1,
          "description": "Qual engine executa este nó (t141). Opcional: ausente significa o engine default do runner (claude-code), resolvido na hora do despacho e nunca na validação — é por isso que todo grafo escrito antes deste campo continua válido sem tocar em nada. Texto livre de propósito, como role e skill_ref.id: quem recusa um engine desconhecido é o runner, com UnknownEngineError, e não um enum fechado que precisaria de edição de schema a cada adapter novo.",
          "examples": ["claude-code", "codex"]
        },
        "model": {
          "type": "string",
          "minLength": 1,
          "description": "Qual modelo do engine executa este nó (t166). Opcional: ausente significa o default do próprio engine — nenhuma flag de modelo é montada, e o argv sai idêntico ao de antes deste campo existir. Texto livre de propósito, pela mesma razão que engine: um enum fechado obrigaria a editar o schema a cada modelo novo, e quem recusa um id desconhecido é a CLI do engine, na abertura da sessão. O catálogo que a API publica é descoberta, não validação.",
          "examples": ["claude-haiku-4-5", "gpt-5.6-luna"]
        },
        "escalation_policy": {
          "enum": ["always", "on_uncertainty", "never"],
          "description": "Quando este nó chama gente (t167). always: escala antes de fechar o nó, mesmo achando que sabe a resposta. on_uncertainty: escala quando trava — o comportamento que todo nó sempre teve. never: não existe a quem perguntar aqui; travar é falha do contrato do nó, e o runner bloqueia o trabalho com motivo em vez de abrir pergunta. Opcional: ausente significa on_uncertainty, resolvido na hora do despacho e nunca na validação, exatamente como engine. Enum fechado, ao contrário de engine, porque aqui os três valores SÃO o vocabulário: um quarto valor não é adapter novo, é erro de quem escreveu.",
          "examples": ["never"]
        },
        "escalation_recipient": {
          "type": "string",
          "description": "Quem deveria ser chamado quando este nó escala (t167). Texto livre e sem formato imposto, como resposta_padrao e respondido_por: não existe sistema de identidade nem de papéis neste repositório para validar contra. Guardado no grafo e devolvido pelo snapshot; nada envia nada para ele ainda — entregar é ficha futura, quando papéis existirem.",
          "examples": ["editor-de-plantao", "arquiteto"]
        },
        "skill_ref": { "$ref": "#/$defs/skill_ref" },
        "contract": { "$ref": "#/$defs/contract" }
      }
    },
    "skill_ref": {
      "type": "object",
      "description": "Ponteiro opaco para uma skill do registro, pinado por versão e hash (D4). O formato interno do manifesto de skill é outro documento (t97) — aqui só o pin importa.",
      "required": ["id", "version", "hash"],
      "additionalProperties": false,
      "properties": {
        "id": {
          "type": "string",
          "minLength": 1,
          "description": "Identificador da skill no registro."
        },
        "version": {
          "type": "string",
          "pattern": "^\\d+\\.\\d+\\.\\d+$",
          "description": "Versão semver da skill."
        },
        "hash": {
          "type": "string",
          "pattern": "^sha256:[0-9a-f]{64}$",
          "description": "Pin por hash do conteúdo da skill (D4): skill importada é vetor de prompt injection; o hash é o que impede troca silenciosa por baixo de um grafo já validado."
        }
      }
    },
    "contract": {
      "type": "object",
      "description": "A peça de sustentação (README princípio 3, D9): entrada e saída em JSON Schema, verificação como lista de checks tipados. Sem contrato o sintetizador compõe por alucinação; com contrato, compor grafo vira casar contratos.",
      "required": ["input_schema", "output_schema", "checks"],
      "additionalProperties": false,
      "properties": {
        "input_schema": {
          "type": "object",
          "description": "JSON Schema da projeção de estado que o nó recebe (README princípio 4: estado explícito, nunca janela comum)."
        },
        "output_schema": {
          "type": "object",
          "description": "JSON Schema do que o nó devolve ao quadro."
        },
        "checks": {
          "type": "array",
          "minItems": 1,
          "description": "Como se confere o que este nó produziu. Pelo menos uma; determinística sempre que possível.",
          "items": { "$ref": "#/$defs/check" }
        }
      }
    },
    "check": {
      "oneOf": [
        { "$ref": "#/$defs/deterministic_check" },
        { "$ref": "#/$defs/agentic_check" }
      ]
    },
    "deterministic_check": {
      "type": "object",
      "description": "Comando que passa ou falha sozinho: rodar teste, validar schema, build.",
      "required": ["type", "command"],
      "additionalProperties": false,
      "properties": {
        "type": { "const": "deterministic" },
        "command": {
          "type": "string",
          "minLength": 1,
          "description": "Comando executável, tal como roda no repositório de trabalho."
        },
        "description": {
          "type": "string",
          "description": "O que este check prova."
        }
      }
    },
    "agentic_check": {
      "type": "object",
      "description": "Check que exige julgamento. Verifica com evidência própria — nunca com o relato de quem fez o trabalho.",
      "required": ["type", "instruction", "required_evidence"],
      "additionalProperties": false,
      "properties": {
        "type": { "const": "agentic" },
        "instruction": {
          "type": "string",
          "minLength": 1,
          "description": "O que o verificador precisa julgar, na forma de pergunta respondível."
        },
        "required_evidence": {
          "const": true,
          "description": "Sempre true (D9): check agêntico sem evidência anexada não é verificação, é opinião."
        },
        "description": {
          "type": "string",
          "description": "O que este check prova."
        }
      }
    },
    "hook": {
      "type": "object",
      "description": "Uma reação declarada pelo grafo. O gancho NÃO participa da travessia: ele não é aresta, não muda o nó atual e não tem como fazer o trabalho parar — falha de gancho é incidente, nunca desfecho. A validação referencial (node_id existe, id único no documento) é estrutural e vive em scripts/validar-grafo.mjs e packages/core/src/domain/graph.ts, não nas quatro regras de soundness: gancho pendurado é defeito de forma, não propriedade da rede de workflow.",
      "required": ["id", "trigger", "node_id", "destination"],
      "additionalProperties": false,
      "properties": {
        "id": {
          "$ref": "#/$defs/node_id",
          "description": "Identificador do gancho, único no documento. Mesma classe de caracteres do id de nó de propósito: são os dois nomes que alguém escreve à mão dentro deste arquivo, e uma regra só é uma regra a menos para lembrar."
        },
        "trigger": {
          "enum": ["node_entered", "node_blocked"],
          "description": "O que dispara. node_entered: uma trabalho.transicao cujo para_no_id é este nó. node_blocked: uma trabalho.bloqueado com o trabalho parado neste nó. Enum fechado, como escalation_policy: um terceiro valor não é adapter novo, é erro de quem escreveu. Nada dispara na chegada ao initial_node — a colocação inicial é trabalho.criado, e não uma transição."
        },
        "node_id": {
          "$ref": "#/$defs/node_id",
          "description": "Nó cuja entrada ou bloqueio dispara o gancho. Precisa existir em nodes."
        },
        "destination": { "$ref": "#/$defs/hook_destination" },
        "description": {
          "type": "string",
          "description": "Para que serve esta reação, em uma frase."
        }
      }
    },
    "hook_destination": {
      "type": "object",
      "description": "Para onde a reação vai. Hoje só webhook: mandar o control plane executar um comando de shell que chegou como DADO de grafo é outra ficha, com portão de revisão/permissão próprio espelhando o da importação de skill (D4).",
      "required": ["type", "url", "secret"],
      "additionalProperties": false,
      "properties": {
        "type": {
          "enum": ["webhook"],
          "description": "Enum de um valor só hoje, para que uma segunda variante (local_command) seja aditiva amanhã, sem quebrar grafo nenhum."
        },
        "url": {
          "type": "string",
          "pattern": "^https?://.+",
          "description": "URL absoluta http: ou https: que recebe o POST. Mesma regra do POST /v1/webhooks (docs/spec/webhooks-eventos.md §2)."
        },
        "secret": {
          "type": "string",
          "minLength": 1,
          "description": "Chave do HMAC da entrega, escolhida por quem escreveu o grafo — o servidor não gera segredo, mesma razão da t142. Fica no documento em texto claro porque a assinatura precisa REUSAR a chave a cada entrega, e porque o documento inteiro já é dado versionado que quem tem a API lê."
        }
      }
    },
    "edge": {
      "type": "object",
      "description": "Transição de um nó para outro, rotulada pelo resultado do nó de origem.",
      "required": ["from", "to", "condition"],
      "additionalProperties": false,
      "properties": {
        "from": { "$ref": "#/$defs/node_id" },
        "to": { "$ref": "#/$defs/node_id" },
        "condition": {
          "type": "string",
          "minLength": 1,
          "description": "Rótulo do resultado do nó de origem (\"aprovado\", \"retrabalho\") quando a origem tem múltiplas saídas, ou o literal \"sempre\" quando tem saída única. String simples de propósito: sem linguagem de expressão antes de existirem dois grafos reais pressionando o formato.",
          "examples": ["sempre", "aprovado", "retrabalho"]
        },
        "description": {
          "type": "string",
          "description": "Quando esta transição acontece, em uma frase."
        }
      }
    }
  }
}
